{
  "$schema": "../../schemas/prompt-schema.json",
  "name": "create-data-analyst",
  "title": "Create Data Analyst Assistant",
  "description": "Generate a data analysis assistant with statistical and visualization capabilities",
  "category": "assistant",
  "tags": ["data", "analytics", "statistics", "assistant"],
  "arguments": [
    {
      "name": "domain",
      "description": "Data analysis domain (e.g., \"business intelligence\", \"scientific research\", \"marketing\")",
      "required": true
    },
    {
      "name": "tools_focus",
      "description": "Primary tools focus (python, r, sql, visualization)",
      "required": false
    }
  ],
  "template": "Create a data analyst assistant specialized in {{domain}} with a focus on {{tools_focus || 'python'}}. The assistant should be capable of data analysis, statistical modeling, and creating visualizations. Include appropriate tools and detailed instructions for data analysis workflows.",
  "examples": [
    {
      "title": "Business intelligence analyst",
      "description": "Create an assistant for business data analysis",
      "arguments": {
        "domain": "business intelligence",
        "tools_focus": "python"
      }
    }
  ],
  "metadata": {
    "version": "1.0.0",
    "author": "Jezweb MCP Core Team",
    "lastModified": "2025-01-31T02:42:00.000Z",
    "usage": "assistant-creation"
  }
}