{
  "$schema": "../../schemas/prompt-schema.json",
  "name": "create-conversation-thread",
  "title": "Create Conversation Thread",
  "description": "Set up a new conversation thread with initial context and metadata",
  "category": "thread",
  "tags": ["thread", "conversation", "setup"],
  "arguments": [
    {
      "name": "purpose",
      "description": "Purpose of the conversation (e.g., \"code review\", \"data analysis\", \"writing help\")",
      "required": true
    },
    {
      "name": "context",
      "description": "Initial context or background information",
      "required": false
    },
    {
      "name": "user_id",
      "description": "User identifier for tracking",
      "required": false
    }
  ],
  "template": "Create a new conversation thread for {{purpose}}. Set up appropriate metadata including user_id: \"{{user_id || 'anonymous'}}\", session_type: \"{{purpose}}\", and timestamp.{{#if context}}\n\nContext: {{context}}{{/if}}",
  "examples": [
    {
      "title": "Code review session",
      "description": "Create a thread for code review with context",
      "arguments": {
        "purpose": "code review",
        "context": "Reviewing Python web application for security and performance",
        "user_id": "dev_123"
      }
    }
  ],
  "metadata": {
    "version": "1.0.0",
    "author": "Jezweb MCP Core Team",
    "lastModified": "2025-01-31T02:42:00.000Z",
    "usage": "thread-management"
  }
}